<?xml version="1.0" encoding="utf-8" ?>
<AppSettings xmlns:xsi="http://www.w3.org/2001/XMLSchema-instance" xsi:noNamespaceSchemaLocation="config.xsd">
    <General>
        <Debug>false</Debug>
        <RemoteTimeOut>21600</RemoteTimeOut>
    </General>
    <Credentials>
        <UserName>acme\adminyk</UserName>
        <Password>abc</Password>
    </Credentials>
    <Email>
        <SendReportsViaEmail>true</SendReportsViaEmail>
        <SMTPServer>smtp.beheer.nl</SMTPServer>
        <MailFrom>sharepoint@beheer.nl</MailFrom>
        <MailTo>sharepoint@beheer.nl</MailTo>
        <MailCC></MailCC>
        <MailBCC></MailBCC>
        <SubjectSuffix></SubjectSuffix>
    </Email>
    <Reporting>
        <ReportsToDisk>false</ReportsToDisk>
        <ReportsFolder>.\Reports</ReportsFolder>
    </Reporting>
    <PatchScan>
        <WSUSCabPath>.</WSUSCabPath>
        <DownloadWSUSFile>false</DownloadWSUSFile>
    </PatchScan>
    <Logging>
        <LogPrefix>PeriodicChecks</LogPrefix>
        <LogFolder>Logs</LogFolder>
        <RemoteLogFolder>C:\Logs</RemoteLogFolder>
    </Logging>
    <Checks>
        <Check Id='31'>
            <Path>C:\Windows\Monitoring</Path>
            <Filename>servicesconfig.txt</Filename>
        </Check>
        <Check Id='50'>
            <WMIClass>HPDSM_PERFINFO</WMIClass>
            <MinLUNPaths>4</MinLUNPaths>
        </Check>
    </Checks>
</AppSettings>
